{
  "schema_version": "1.0",
  "job_id": "EP-011",
  "title": "Fix tooltip remnant artifacts in notation panel toggle buttons",
  "state": "done",
  "type": "bugfix",
  "priority": 3,
  "source": {},
  "description": "Fix tooltip remnant artifacts in notation panel toggle buttons",
  "scope": {
    "in_scope": ["TODO: define what this job covers"],
    "out_of_scope": ["TODO: define what is excluded"]
  },
  "contracts": {
    "correctness": {
      "requirements": ["TODO: define correctness requirements"]
    },
    "performance": {
      "no_regression": true
    },
    "compatibility": {
      "backward_compatible": true,
      "migration_needed": false
    }
  },
  "acceptance_gates": [
    "All automated tests pass",
    "pnpm format && pnpm lint:fix clean",
    "TODO: add job-specific gates"
  ],
  "test_plan": {
    "automated": [
      {
        "name": "cargo test",
        "command": "cd src-tauri && cargo test"
      },
      {
        "name": "lint",
        "command": "pnpm lint:fix"
      }
    ],
    "manual": ["TODO: define manual verification steps"]
  },
  "primary_files": ["TODO: list files to be modified"],
  "done_criteria": ["TODO: define when this job is complete"]
}
