{
  "schema_version": "1.0",
  "job_id": "EP-007",
  "title": "Cherry-pick PR #720: Strip [%timestamp] annotations from PGN comments",
  "state": "done",
  "type": "cherry_pick",
  "priority": 2,
  "source": {
    "upstream_pr": 720,
    "url": "https://github.com/franciscoBSalgueiro/en-croissant/pull/720",
    "notes": "Merged 2026-03-01T23:44:07Z"
  },
  "description": "## Summary\n- Strip `[%timestamp N]` annotations from PGN comment text after parsing\n- Chess.com exports include both `[%clk 0:09:59.9]` and `[%timestamp 1]` in move comments. The `[%clk]` is already parsed by chessops, but `[%timestamp]` was left in the displayed comment text, cluttering the notation\n- The `[%timestamp]` value represents elapsed seconds since game start (not remaining clock time), so it can't be reliably converted to a clock value without time control info. The `[%clk]` value is",
  "notes": ["Upstream files: src/utils/chess.ts", "Labels: none"],
  "scope": {
    "in_scope": [
      "Port upstream PR #720 changes to our fork",
      "Resolve any merge conflicts with our modifications",
      "Verify the fix works in our build"
    ],
    "out_of_scope": ["Unrelated changes to the same files", "Upstream features we haven't adopted"]
  },
  "contracts": {
    "correctness": {
      "requirements": [
        "The bug/feature from PR #720 works correctly",
        "No regressions in existing functionality"
      ],
      "edge_cases": ["TODO: identify edge cases"]
    },
    "performance": {
      "no_regression": true
    },
    "compatibility": {
      "backward_compatible": true,
      "migration_needed": false
    }
  },
  "acceptance_gates": [
    "cargo test passes",
    "pnpm format && pnpm lint:fix clean",
    "PR #720 behavior verified in running app"
  ],
  "test_plan": {
    "automated": [
      {
        "name": "cargo test",
        "command": "cd src-tauri && cargo test"
      },
      {
        "name": "lint",
        "command": "pnpm lint:fix"
      }
    ],
    "manual": ["Verify PR #720 fix in running app", "TODO: specific verification steps"]
  },
  "primary_files": ["src/utils/chess.ts"],
  "done_criteria": [
    "PR #720 changes successfully ported",
    "All tests pass",
    "Verified in running app",
    "Committed and pushed"
  ],
  "iteration_log": [
    {
      "timestamp": "2026-04-04T03:30:30Z",
      "action": "Verified already cherry-picked",
      "result": "Timestamp stripping present at chess.ts:417 with broader regex",
      "keep_or_discard": "keep"
    }
  ]
}
