{
  "schema_version": "1.0",
  "job_id": "EP-002",
  "title": "Cherry-pick PR #782: Fix regex in the chess.com link import",
  "state": "done",
  "type": "cherry_pick",
  "priority": 1,
  "source": {
    "upstream_pr": 782,
    "url": "https://github.com/franciscoBSalgueiro/en-croissant/pull/782",
    "notes": "Merged 2026-03-29T19:45:14Z"
  },
  "description": "The chess.com game import regex requires /live/ or /daily/ in the URL path, but chess.com sometimes omits this segment in post-game URLs (e.g. chess.com/game/12345). The fix makes the live/daily segment optional and defaults to 'live' when absent.",
  "notes": [
    "2-line change in one file — minimal risk",
    "Old regex: /.*\\/game\\/(live|daily)\\/(\\d+)/",
    "New regex: /.*\\/game\\/(?:(live|daily)\\/)?(\\d+)/",
    "Also change: match[1] fallback to 'live' when group is undefined"
  ],
  "scope": {
    "in_scope": [
      "Update regex in getChesscomGame to make live/daily optional",
      "Default gameType to 'live' when the URL segment is absent"
    ],
    "out_of_scope": ["Other chess.com API changes", "Lichess import logic"]
  },
  "contracts": {
    "correctness": {
      "requirements": [
        "URLs with /game/live/12345 still work (existing behavior)",
        "URLs with /game/daily/12345 still work (existing behavior)",
        "URLs with /game/12345 now work (new behavior, defaults to live)"
      ],
      "edge_cases": [
        "URL with trailing slash: /game/12345/",
        "URL with query params: /game/12345?foo=bar",
        "URL with no game ID should still return null",
        "Empty string input"
      ]
    },
    "performance": {
      "no_regression": true
    },
    "compatibility": {
      "backward_compatible": true,
      "migration_needed": false
    }
  },
  "acceptance_gates": [
    "cargo test passes",
    "pnpm format && pnpm lint:fix clean",
    "Regex matches all 3 URL formats correctly"
  ],
  "test_plan": {
    "automated": [
      {
        "name": "cargo test",
        "command": "cd src-tauri && cargo test"
      },
      {
        "name": "lint",
        "command": "pnpm lint:fix"
      }
    ],
    "manual": [
      "In running app: paste a chess.com URL like https://www.chess.com/game/12345 (no live/daily) and verify it loads",
      "Paste https://www.chess.com/game/live/12345 and verify it still works",
      "Paste https://www.chess.com/game/daily/12345 and verify it still works"
    ]
  },
  "primary_files": ["src/utils/chess.com/api.tsx"],
  "done_criteria": [
    "Regex updated to make live/daily optional",
    "gameType defaults to 'live' when segment absent",
    "All tests pass",
    "Committed and pushed"
  ]
}
